{
  "schema_version": "tts-quality-sample-v1",
  "sample_id": "qwen3-tts-1.7b-base-expanded-russian-v1:homograph-stoit",
  "case_id": "homograph-stoit",
  "corpus_version": "1.1.0",
  "source_text": "У ворот стоит часовой, но тебе не стоит подходить к нему слишком близко.",
  "tts_text": "У ворот стоит часовой, но тебе не стоит подходить к нему слишком близко.",
  "normalizer_version": "canonical-source-v1",
  "segmenter_version": "none-whole-text-v1",
  "engine": "Qwen3-TTS",
  "model": "Qwen/Qwen3-TTS-12Hz-1.7B-Base",
  "model_revision": "fd4b254389122332181a7c3db7f27e918eec64e3",
  "seed": 42,
  "inference_config": {
    "mode": "voice_clone",
    "language": "Russian",
    "dtype": "bfloat16",
    "attention": "sdpa",
    "generation_options": "checkpoint_defaults",
    "speed": 1.0
  },
  "speaker_reference_sha256": "79c7e0aed87028368af208f8e7cb1a0d9716eddfa83336dcdd840f5fe95975f8",
  "artifact": {
    "relative_path": "homograph-stoit.wav",
    "sha256": "594341b313ed61c4d5fcc2a77c5a058b60a9112fcfa2450e80e35c4a33dabd6e",
    "pcm_sha256": "23f619fadaf8665720856e00a766a81f85f4f2f9f452b653020d797e1041dda8",
    "worker_reported_pcm_sha256": null,
    "codec": "pcm_s16le",
    "sample_rate_hz": 24000,
    "channels": 1,
    "duration_seconds": 4.160000,
    "peak_dbfs": null,
    "rms_dbfs": null,
    "lufs_i": null,
    "clipping_percent": null,
    "silence_ratio": null,
    "leading_silence_seconds": null,
    "trailing_silence_seconds": null,
    "contains_nan_or_inf": null
  },
  "timing": {
    "preprocessing_seconds": null,
    "tokenization_seconds": null,
    "inference_seconds": null,
    "vocoder_seconds": null,
    "audio_io_seconds": null,
    "generation_seconds": 3.184054,
    "audio_seconds": 4.160000,
    "rtf": 0.765397596,
    "peak_vram_bytes": null
  },
  "worker_response": {
    "generation_duration_ms": 3184,
    "audio_duration_ms": 4160,
    "seed_used": 42,
    "voice_cache_hit": null,
    "warnings": []
  },
  "chunks": [
    {
      "index": 0,
      "request_id": "5d13ca31e13341f1a91a93fb4a991895",
      "text": "У ворот стоит часовой, но тебе не стоит подходить к нему слишком близко.",
      "seed": 42,
      "pcm_sha256": "23f619fadaf8665720856e00a766a81f85f4f2f9f452b653020d797e1041dda8",
      "worker_reported_pcm_sha256": null,
      "audio_duration_ms": 4160,
      "generation_duration_ms": 3184,
      "warnings": []
    }
  ]
}
