{
  "schema_version": "tts-quality-sample-v1",
  "sample_id": "qwen3-tts-1.7b-base-raw-v1:heading-chapter-seven-words",
  "case_id": "heading-chapter-seven-words",
  "corpus_version": "1.1.0",
  "source_text": "Глава седьмая.\n\nПервый снег выпал ночью. К утру город стал неузнаваем.",
  "tts_text": "Глава седьмая.\n\nПервый снег выпал ночью. К утру город стал неузнаваем.",
  "normalizer_version": "canonical-source-v1",
  "segmenter_version": "none-whole-text-v1",
  "engine": "Qwen3-TTS",
  "model": "Qwen/Qwen3-TTS-12Hz-1.7B-Base",
  "model_revision": "fd4b254389122332181a7c3db7f27e918eec64e3",
  "seed": 42,
  "inference_config": {
    "mode": "voice_clone",
    "language": "Russian",
    "dtype": "bfloat16",
    "attention": "sdpa",
    "generation_options": "checkpoint_defaults",
    "speed": 1.0
  },
  "speaker_reference_sha256": "79c7e0aed87028368af208f8e7cb1a0d9716eddfa83336dcdd840f5fe95975f8",
  "artifact": {
    "relative_path": "heading-chapter-seven-words.wav",
    "sha256": "640306baa199ad62149ad39e2abe57a6ec30208ed1f8a7cb3fe1bc96d6148af0",
    "pcm_sha256": "ecc91aa8ce49b2ff18e48a990d3e9263330381d07cce8b90a07ef8a87b73b0ea",
    "worker_reported_pcm_sha256": null,
    "codec": "pcm_s16le",
    "sample_rate_hz": 24000,
    "channels": 1,
    "duration_seconds": 4.960000,
    "peak_dbfs": null,
    "rms_dbfs": null,
    "lufs_i": null,
    "clipping_percent": null,
    "silence_ratio": null,
    "leading_silence_seconds": null,
    "trailing_silence_seconds": null,
    "contains_nan_or_inf": null
  },
  "timing": {
    "preprocessing_seconds": null,
    "tokenization_seconds": null,
    "inference_seconds": null,
    "vocoder_seconds": null,
    "audio_io_seconds": null,
    "generation_seconds": 3.776565,
    "audio_seconds": 4.960000,
    "rtf": 0.761404234,
    "peak_vram_bytes": null
  },
  "worker_response": {
    "generation_duration_ms": 3777,
    "audio_duration_ms": 4960,
    "seed_used": 42,
    "voice_cache_hit": null,
    "warnings": []
  },
  "chunks": [
    {
      "index": 0,
      "request_id": "e2c1848fda11439ba4d7407c417de753",
      "text": "Глава седьмая.\n\nПервый снег выпал ночью. К утру город стал неузнаваем.",
      "seed": 42,
      "pcm_sha256": "ecc91aa8ce49b2ff18e48a990d3e9263330381d07cce8b90a07ef8a87b73b0ea",
      "worker_reported_pcm_sha256": null,
      "audio_duration_ms": 4960,
      "generation_duration_ms": 3777,
      "warnings": []
    }
  ]
}
