{
  "schema_version": "tts-quality-sample-v1",
  "sample_id": "omnivoice-current-expanded-russian-v1:numbers-gender-and-ordinal",
  "case_id": "numbers-gender-and-ordinal",
  "corpus_version": "1.1.0",
  "source_text": "В комнате стоял 21 стул и лежала 21 книга. Он занял 21-й ряд, вернулся к 21-му пункту и не дошёл до 21-го километра.",
  "tts_text": "В комнате стоял 21 стул и лежала 21 книга. Он занял 21-й ряд, вернулся к 21-му пункту и не дошёл до 21-го километра.",
  "normalizer_version": "canonical-source-v1",
  "segmenter_version": "none-whole-text-v1",
  "engine": "OmniVoice",
  "model": "k2-fsa/OmniVoice",
  "model_revision": "c5fdb5ccb189668d56333f77ba2629f4cd7535f4",
  "seed": 42,
  "inference_config": {
    "mode": "VOICE_CLONE",
    "num_steps": 32,
    "guidance_scale": 2.0,
    "speed": 1.0,
    "normalize_text": true,
    "denoise": true,
    "t_shift": 0.1,
    "layer_penalty_factor": 5.0,
    "position_temperature": 5.0,
    "class_temperature": 0.0,
    "preprocess_prompt": true,
    "postprocess_output": true,
    "audio_chunk_duration": 15.0,
    "audio_chunk_threshold": 30.0,
    "pad_duration": 0.1,
    "fade_duration": 0.03
  },
  "speaker_reference_sha256": "79c7e0aed87028368af208f8e7cb1a0d9716eddfa83336dcdd840f5fe95975f8",
  "artifact": {
    "relative_path": "numbers-gender-and-ordinal.wav",
    "sha256": "f6c4069d4b893fbc582a8661b8e84366fc4457b485ccdc3bcab5ad8efb99c15c",
    "pcm_sha256": "7fbefdc81d61b7d82c566135f75dba5d29d0060ac6ae3eee299358a0ce288a75",
    "worker_reported_pcm_sha256": null,
    "codec": "pcm_s16le",
    "sample_rate_hz": 24000,
    "channels": 1,
    "duration_seconds": 10.200000,
    "peak_dbfs": null,
    "rms_dbfs": null,
    "lufs_i": null,
    "clipping_percent": null,
    "silence_ratio": null,
    "leading_silence_seconds": null,
    "trailing_silence_seconds": null,
    "contains_nan_or_inf": null
  },
  "timing": {
    "preprocessing_seconds": null,
    "tokenization_seconds": null,
    "inference_seconds": null,
    "vocoder_seconds": null,
    "audio_io_seconds": null,
    "generation_seconds": 0.970000,
    "audio_seconds": 10.200000,
    "rtf": 0.095098039,
    "peak_vram_bytes": null
  },
  "worker_response": {
    "generation_duration_ms": 970,
    "audio_duration_ms": 10200,
    "seed_used": 42,
    "voice_cache_hit": true,
    "warnings": []
  },
  "chunks": [
    {
      "index": 0,
      "request_id": "exp-numbers-gender-and-ordinal",
      "text": "В комнате стоял 21 стул и лежала 21 книга. Он занял 21-й ряд, вернулся к 21-му пункту и не дошёл до 21-го километра.",
      "seed": 42,
      "pcm_sha256": "7fbefdc81d61b7d82c566135f75dba5d29d0060ac6ae3eee299358a0ce288a75",
      "worker_reported_pcm_sha256": null,
      "audio_duration_ms": 10200,
      "generation_duration_ms": 970,
      "warnings": []
    }
  ]
}
