{
  "schema_version": "tts-quality-sample-v1",
  "sample_id": "omnivoice-current-expanded-russian-v1:dates-numeric-and-words",
  "case_id": "dates-numeric-and-words",
  "corpus_version": "1.1.0",
  "source_text": "Встречу назначили на 18.08.2026, а письмо было отправлено 18 августа 2026 года. В 1941 году семья уехала; до 2026 года архив оставался закрытым.",
  "tts_text": "Встречу назначили на 18.08.2026, а письмо было отправлено 18 августа 2026 года. В 1941 году семья уехала; до 2026 года архив оставался закрытым.",
  "normalizer_version": "canonical-source-v1",
  "segmenter_version": "none-whole-text-v1",
  "engine": "OmniVoice",
  "model": "k2-fsa/OmniVoice",
  "model_revision": "c5fdb5ccb189668d56333f77ba2629f4cd7535f4",
  "seed": 42,
  "inference_config": {
    "mode": "VOICE_CLONE",
    "num_steps": 32,
    "guidance_scale": 2.0,
    "speed": 1.0,
    "normalize_text": true,
    "denoise": true,
    "t_shift": 0.1,
    "layer_penalty_factor": 5.0,
    "position_temperature": 5.0,
    "class_temperature": 0.0,
    "preprocess_prompt": true,
    "postprocess_output": true,
    "audio_chunk_duration": 15.0,
    "audio_chunk_threshold": 30.0,
    "pad_duration": 0.1,
    "fade_duration": 0.03
  },
  "speaker_reference_sha256": "79c7e0aed87028368af208f8e7cb1a0d9716eddfa83336dcdd840f5fe95975f8",
  "artifact": {
    "relative_path": "dates-numeric-and-words.wav",
    "sha256": "715a4452e9b4876414ee7adbd51a0bde25cf284f41279678a037ff25172d7769",
    "pcm_sha256": "bac77ca9fc0ebb1bc0ff61063b1ea05e08702ac75710561d9c711a21174df262",
    "worker_reported_pcm_sha256": null,
    "codec": "pcm_s16le",
    "sample_rate_hz": 24000,
    "channels": 1,
    "duration_seconds": 15.760000,
    "peak_dbfs": null,
    "rms_dbfs": null,
    "lufs_i": null,
    "clipping_percent": null,
    "silence_ratio": null,
    "leading_silence_seconds": null,
    "trailing_silence_seconds": null,
    "contains_nan_or_inf": null
  },
  "timing": {
    "preprocessing_seconds": null,
    "tokenization_seconds": null,
    "inference_seconds": null,
    "vocoder_seconds": null,
    "audio_io_seconds": null,
    "generation_seconds": 1.271000,
    "audio_seconds": 15.760000,
    "rtf": 0.080647208,
    "peak_vram_bytes": null
  },
  "worker_response": {
    "generation_duration_ms": 1271,
    "audio_duration_ms": 15760,
    "seed_used": 42,
    "voice_cache_hit": true,
    "warnings": []
  },
  "chunks": [
    {
      "index": 0,
      "request_id": "exp-dates-numeric-and-words",
      "text": "Встречу назначили на 18.08.2026, а письмо было отправлено 18 августа 2026 года. В 1941 году семья уехала; до 2026 года архив оставался закрытым.",
      "seed": 42,
      "pcm_sha256": "bac77ca9fc0ebb1bc0ff61063b1ea05e08702ac75710561d9c711a21174df262",
      "worker_reported_pcm_sha256": null,
      "audio_duration_ms": 15760,
      "generation_duration_ms": 1271,
      "warnings": []
    }
  ]
}
