{
  "schema_version": "tts-quality-sample-v1",
  "sample_id": "qwen3-tts-1.7b-base-expanded-prosody-v1:poetry-stanza",
  "case_id": "poetry-stanza",
  "corpus_version": "1.1.0",
  "source_text": "Ночь над рекою тиха,\nСвет от луны серебрится.\nЛодка качнулась слегка —\nПутнику снова не спится.",
  "tts_text": "Ночь над рекою тиха,\nСвет от луны серебрится.\nЛодка качнулась слегка —\nПутнику снова не спится.",
  "normalizer_version": "canonical-source-v1",
  "segmenter_version": "none-whole-text-v1",
  "engine": "Qwen3-TTS",
  "model": "Qwen/Qwen3-TTS-12Hz-1.7B-Base",
  "model_revision": "fd4b254389122332181a7c3db7f27e918eec64e3",
  "seed": 42,
  "inference_config": {
    "mode": "voice_clone",
    "language": "Russian",
    "dtype": "bfloat16",
    "attention": "sdpa",
    "generation_options": "checkpoint_defaults",
    "speed": 1.0
  },
  "speaker_reference_sha256": "79c7e0aed87028368af208f8e7cb1a0d9716eddfa83336dcdd840f5fe95975f8",
  "artifact": {
    "relative_path": "poetry-stanza.wav",
    "sha256": "ded3e9807c5d789b66e88147356a7bbd7680765303c78dff520dfa50015a3bac",
    "pcm_sha256": "8c9c9b4ff1fd2c57711fb787b721eff7bf1ef9805891c44a7a61cbb0d6be0de0",
    "worker_reported_pcm_sha256": null,
    "codec": "pcm_s16le",
    "sample_rate_hz": 24000,
    "channels": 1,
    "duration_seconds": 6.480042,
    "peak_dbfs": null,
    "rms_dbfs": null,
    "lufs_i": null,
    "clipping_percent": null,
    "silence_ratio": null,
    "leading_silence_seconds": null,
    "trailing_silence_seconds": null,
    "contains_nan_or_inf": null
  },
  "timing": {
    "preprocessing_seconds": null,
    "tokenization_seconds": null,
    "inference_seconds": null,
    "vocoder_seconds": null,
    "audio_io_seconds": null,
    "generation_seconds": 4.942678,
    "audio_seconds": 6.480042,
    "rtf": 0.762754007,
    "peak_vram_bytes": null
  },
  "worker_response": {
    "generation_duration_ms": 4943,
    "audio_duration_ms": 6480,
    "seed_used": 42,
    "voice_cache_hit": null,
    "warnings": []
  },
  "chunks": [
    {
      "index": 0,
      "request_id": "79b961338cb84c1f81a142c7f6c17104",
      "text": "Ночь над рекою тиха,\nСвет от луны серебрится.\nЛодка качнулась слегка —\nПутнику снова не спится.",
      "seed": 42,
      "pcm_sha256": "8c9c9b4ff1fd2c57711fb787b721eff7bf1ef9805891c44a7a61cbb0d6be0de0",
      "worker_reported_pcm_sha256": null,
      "audio_duration_ms": 6480,
      "generation_duration_ms": 4943,
      "warnings": []
    }
  ]
}
