{
  "schema_version": "tts-quality-sample-v1",
  "sample_id": "qwen3-tts-1.7b-base-expanded-russian-v1:units-and-percent",
  "case_id": "units-and-percent",
  "corpus_version": "1.1.0",
  "source_text": "Посылка весила 5 кг, влажность достигла 3 %, а машина двигалась со скоростью 10 км/ч. До станции оставалось 12 км.",
  "tts_text": "Посылка весила 5 кг, влажность достигла 3 %, а машина двигалась со скоростью 10 км/ч. До станции оставалось 12 км.",
  "normalizer_version": "canonical-source-v1",
  "segmenter_version": "none-whole-text-v1",
  "engine": "Qwen3-TTS",
  "model": "Qwen/Qwen3-TTS-12Hz-1.7B-Base",
  "model_revision": "fd4b254389122332181a7c3db7f27e918eec64e3",
  "seed": 42,
  "inference_config": {
    "mode": "voice_clone",
    "language": "Russian",
    "dtype": "bfloat16",
    "attention": "sdpa",
    "generation_options": "checkpoint_defaults",
    "speed": 1.0
  },
  "speaker_reference_sha256": "79c7e0aed87028368af208f8e7cb1a0d9716eddfa83336dcdd840f5fe95975f8",
  "artifact": {
    "relative_path": "units-and-percent.wav",
    "sha256": "e1cee77f7503c6ce894f134665a798524186868e7bf899d540382af45649a339",
    "pcm_sha256": "058fc42b9845f710d193c11922874735bda6ef4666652bce3c2dc51f6db10539",
    "worker_reported_pcm_sha256": null,
    "codec": "pcm_s16le",
    "sample_rate_hz": 24000,
    "channels": 1,
    "duration_seconds": 9.200000,
    "peak_dbfs": null,
    "rms_dbfs": null,
    "lufs_i": null,
    "clipping_percent": null,
    "silence_ratio": null,
    "leading_silence_seconds": null,
    "trailing_silence_seconds": null,
    "contains_nan_or_inf": null
  },
  "timing": {
    "preprocessing_seconds": null,
    "tokenization_seconds": null,
    "inference_seconds": null,
    "vocoder_seconds": null,
    "audio_io_seconds": null,
    "generation_seconds": 6.954368,
    "audio_seconds": 9.200000,
    "rtf": 0.755909565,
    "peak_vram_bytes": null
  },
  "worker_response": {
    "generation_duration_ms": 6954,
    "audio_duration_ms": 9200,
    "seed_used": 42,
    "voice_cache_hit": null,
    "warnings": []
  },
  "chunks": [
    {
      "index": 0,
      "request_id": "6db871a3e60e416fb3f8a95ad91691b9",
      "text": "Посылка весила 5 кг, влажность достигла 3 %, а машина двигалась со скоростью 10 км/ч. До станции оставалось 12 км.",
      "seed": 42,
      "pcm_sha256": "058fc42b9845f710d193c11922874735bda6ef4666652bce3c2dc51f6db10539",
      "worker_reported_pcm_sha256": null,
      "audio_duration_ms": 9200,
      "generation_duration_ms": 6954,
      "warnings": []
    }
  ]
}
