{
  "schema_version": "tts-quality-sample-v1",
  "sample_id": "chatterbox-multilingual-v3-raw-v1:dialogue-question-answer",
  "case_id": "dialogue-question-answer",
  "corpus_version": "1.1.0",
  "source_text": "— Ты действительно собираешься туда идти? — спросила Анна.\n— А у меня есть выбор? — ответил он.",
  "tts_text": "— Ты действительно собираешься туда идти? — спросила Анна.\n— А у меня есть выбор? — ответил он.",
  "normalizer_version": "canonical-source-v1",
  "segmenter_version": "none-whole-text-v1",
  "engine": "Chatterbox Multilingual V3",
  "model": "ResembleAI/chatterbox",
  "model_revision": "5bb1f6ee58e50c3b8d408bc82a6d3740c2db6e18",
  "seed": 42,
  "inference_config": {
    "mode": "voice_clone",
    "language": "ru",
    "t3_model": "v3",
    "dtype": "float32",
    "exaggeration": 0.5,
    "cfg_weight": 0.5,
    "temperature": 0.8,
    "repetition_penalty": 1.2,
    "min_p": 0.05,
    "top_p": 1.0,
    "speed": 1.0,
    "reference_text_used": false,
    "watermarked": true
  },
  "speaker_reference_sha256": "79c7e0aed87028368af208f8e7cb1a0d9716eddfa83336dcdd840f5fe95975f8",
  "artifact": {
    "relative_path": "dialogue-question-answer.wav",
    "sha256": "63de9350754d87269b9e2a189a318418a899db1d5410a9525a374d74a8af17c0",
    "pcm_sha256": "f55539bbc164c11ce258ee5dad7d9dafab51362b4f57c49f99f91b8201ff672f",
    "worker_reported_pcm_sha256": null,
    "codec": "pcm_s16le",
    "sample_rate_hz": 24000,
    "channels": 1,
    "duration_seconds": 5.040000,
    "peak_dbfs": null,
    "rms_dbfs": null,
    "lufs_i": null,
    "clipping_percent": null,
    "silence_ratio": null,
    "leading_silence_seconds": null,
    "trailing_silence_seconds": null,
    "contains_nan_or_inf": null
  },
  "timing": {
    "preprocessing_seconds": null,
    "tokenization_seconds": null,
    "inference_seconds": null,
    "vocoder_seconds": null,
    "audio_io_seconds": null,
    "generation_seconds": 1.525958,
    "audio_seconds": 5.040000,
    "rtf": 0.302769444,
    "peak_vram_bytes": null
  },
  "worker_response": {
    "generation_duration_ms": 1526,
    "audio_duration_ms": 5040,
    "seed_used": 42,
    "voice_cache_hit": null,
    "warnings": []
  },
  "chunks": [
    {
      "index": 0,
      "request_id": "c1c7a1e43e5d4fd0807414efae96013c",
      "text": "— Ты действительно собираешься туда идти? — спросила Анна.\n— А у меня есть выбор? — ответил он.",
      "seed": 42,
      "pcm_sha256": "f55539bbc164c11ce258ee5dad7d9dafab51362b4f57c49f99f91b8201ff672f",
      "worker_reported_pcm_sha256": null,
      "audio_duration_ms": 5040,
      "generation_duration_ms": 1526,
      "warnings": []
    }
  ]
}
