{
  "schema_version": "tts-quality-sample-v1",
  "sample_id": "omnivoice-current-expanded-russian-v1:initials-spaced-and-compact",
  "case_id": "initials-spaced-and-compact",
  "corpus_version": "1.1.0",
  "source_text": "А. С. Пушкин родился в Москве, а Л.Н. Толстой — в Ясной Поляне. Инициалы И. А. Бунина нельзя превращать в отдельные предложения.",
  "tts_text": "А. С. Пушкин родился в Москве, а Л.Н. Толстой — в Ясной Поляне. Инициалы И. А. Бунина нельзя превращать в отдельные предложения.",
  "normalizer_version": "canonical-source-v1",
  "segmenter_version": "none-whole-text-v1",
  "engine": "OmniVoice",
  "model": "k2-fsa/OmniVoice",
  "model_revision": "c5fdb5ccb189668d56333f77ba2629f4cd7535f4",
  "seed": 42,
  "inference_config": {
    "mode": "VOICE_CLONE",
    "num_steps": 32,
    "guidance_scale": 2.0,
    "speed": 1.0,
    "normalize_text": true,
    "denoise": true,
    "t_shift": 0.1,
    "layer_penalty_factor": 5.0,
    "position_temperature": 5.0,
    "class_temperature": 0.0,
    "preprocess_prompt": true,
    "postprocess_output": true,
    "audio_chunk_duration": 15.0,
    "audio_chunk_threshold": 30.0,
    "pad_duration": 0.1,
    "fade_duration": 0.03
  },
  "speaker_reference_sha256": "79c7e0aed87028368af208f8e7cb1a0d9716eddfa83336dcdd840f5fe95975f8",
  "artifact": {
    "relative_path": "initials-spaced-and-compact.wav",
    "sha256": "bd3f985d5aff12eece83b9b1aa089aa5c1a563ba21cb3e7f0b5112b7d1799563",
    "pcm_sha256": "0d25d107cfac2f7b4e1fa902c1928c543c83b7af3fd1996cbebf48efa5959eaf",
    "worker_reported_pcm_sha256": null,
    "codec": "pcm_s16le",
    "sample_rate_hz": 24000,
    "channels": 1,
    "duration_seconds": 7.440000,
    "peak_dbfs": null,
    "rms_dbfs": null,
    "lufs_i": null,
    "clipping_percent": null,
    "silence_ratio": null,
    "leading_silence_seconds": null,
    "trailing_silence_seconds": null,
    "contains_nan_or_inf": null
  },
  "timing": {
    "preprocessing_seconds": null,
    "tokenization_seconds": null,
    "inference_seconds": null,
    "vocoder_seconds": null,
    "audio_io_seconds": null,
    "generation_seconds": 0.825000,
    "audio_seconds": 7.440000,
    "rtf": 0.110887097,
    "peak_vram_bytes": null
  },
  "worker_response": {
    "generation_duration_ms": 825,
    "audio_duration_ms": 7440,
    "seed_used": 42,
    "voice_cache_hit": true,
    "warnings": []
  },
  "chunks": [
    {
      "index": 0,
      "request_id": "exp-initials-spaced-and-compact",
      "text": "А. С. Пушкин родился в Москве, а Л.Н. Толстой — в Ясной Поляне. Инициалы И. А. Бунина нельзя превращать в отдельные предложения.",
      "seed": 42,
      "pcm_sha256": "0d25d107cfac2f7b4e1fa902c1928c543c83b7af3fd1996cbebf48efa5959eaf",
      "worker_reported_pcm_sha256": null,
      "audio_duration_ms": 7440,
      "generation_duration_ms": 825,
      "warnings": []
    }
  ]
}
